version_date,title,brief,keyword,url
2023-01-27 13:53:18,华灯璀璨年味浓 流光溢彩闹新春,春节假期，白天的活动丰富多彩，到了夜间，各地也是花灯璀璨、精彩纷呈。在河南、四川等地的人们，就在夜间纷纷走出家门，赏花灯、品年味，感受春节气氛。,华灯璀璨年味浓 流光溢彩闹新春,https://news.cctv.com/2023/01/27/ARTICZAs78eXM56ILLTNTPfP230127.shtml
2023-01-27 13:50:48,计划增开298趟、重联261趟！长三角铁路积极应对返程客流高峰,1月27日（大年初六）是春节假期的最后一天，长三角铁路迎来返程客流最高峰，当天预计发送旅客193万人次，计划增开旅客列车298趟，对261趟动车组列车进行重联编组，全力保障大客流环境下旅客安全、有序出行。,长三角铁路,https://news.cctv.com/2023/01/27/ARTIV3ZjTX5Dm6XZ1mM3KPe0230127.shtml
2023-01-27 13:35:08,过年 | 我在高原修隧道,西藏拉萨到日喀则的拉日高速公路正在紧张建设中，其中，控制性工程普巴隧道因海拔高、地质条件复杂，是目前隧道施工中难度最大的一段。为保证整个工程能顺利完成，300多名建设者正昼夜不停地施工。,过年 高原 修隧道 建设者,https://news.cctv.com/2023/01/27/ARTI90OCjtjl6x1JAfIy88r1230127.shtml
2023-01-27 13:34:57,返乡、出行、消费 “流动的中国充满活力”,机场、火车站排起的长队，商场、街头挂起的大红灯笼，旅游景点攒动的人群，热气腾腾的年夜饭……作为中国最重要的传统佳节，春节成了世界观察中国的一扇窗。目睹一片欢腾，有外媒感叹“看到一个充满活力、生机盎然的中国”，也有外国网友认为“中国春节的热闹景象温暖了世界”。,返乡 出行 消费 “流动的中国充满活力”,https://news.cctv.com/2023/01/27/ARTIzDCECmf2OIOOGyf97r4p230127.shtml
2023-01-27 13:31:00,超162亿人次！总台春晚热四海，全球共享中国年！,农历除夕，中央广播电视总台《2023年春节联欢晚会》如约而至，为海内外亿万观众送上了一道红红火火中国年的文化大餐。海内外传播效果均创历史新高，全媒体累计触达162.16亿人次，173个国家和地区的1000多家媒体进行同步直播和报道。,总台 春晚,https://news.cctv.com/2023/01/27/ARTInwiUlgeH69fkMG2v0mJ9230127.shtml
2023-01-27 13:30:29,春节消费强劲 离岛免税日均销售额突破3亿元,这个春节各地各大商圈人气也非常旺盛，人们外出购物、就餐、娱乐热情高涨，不少餐饮门店排起长队。,春节消费 强劲 离岛免税 日均 销售额,https://news.cctv.com/2023/01/27/ARTIFZ1WKi7DTQZP24rQfdEf230127.shtml
2023-01-27 13:30:20,珠海边检总站查验出入境人员上涨约75%,据珠海边检总站介绍，春节假期前5天（1月21日—25日），珠海边检总站查验出入境人员120万人次，较去年春节同期大幅上涨约75%，恢复至2019年的六成左右。,珠海边检总站 查验 出入境人员 上涨,https://news.cctv.com/2023/01/27/ARTI77Ib1Eaz5D6BJSS9ggjC230127.shtml
2023-01-27 12:55:34,山西应县木塔景区提前关门赶人？官方：基本属实，涉事工作人员停职处理,1月26日，网上出现“应县木塔工作人员被指提前下班赶游客”的视频。应县文化和旅游局立即成立专项调查组，对此事件进行调查核实。,应县木塔景区,https://news.cctv.com/2023/01/27/ARTIx0y8xUYTAPqUyklssKUq230127.shtml
2023-01-27 12:44:50,模范带头，党员春节守战位,天寒地冻，中俄界江黑龙江，冰层厚度达1.8米，最低气温降至近零下40摄氏度。大年初一清晨，迎着刺骨的寒风，二级上士、班长赵子龙带领战友踏上了轮换界江冰哨的巡逻路。,党员干部 官兵 黑河好八连,https://news.cctv.com/2023/01/27/ARTISnG0jggNyplGqv8KhSuw230127.shtml
2023-01-27 12:19:58,北京交通：预计今日16时起进城方向部分路段车流量集中将拥堵,1月26日，全市交通运行总体平稳，城际交通（铁路、民航、公路省际客运）较2022年增长204.15%，较2019年下降19.00%；市内公共交通（地面公交、轨道交通）较2022年增长2.68%，较2019年下降35.48%。,北京交通,https://news.cctv.com/2023/01/27/ARTIJgy1QVXLVrDogphq4YH5230127.shtml
2023-01-27 12:17:54,春节返京高峰期，各车站、公交、地铁保障措施看这里！,1月26日开始，北京地区进入春节返京高峰期。从北京市重点站区管委会获悉，针对返程阶段客流高峰，本市将协调落实加密公交、地铁延时、出租保点、开辟网约车专用落客区、开行免费摆渡车等措施，同时协调电子地图导航公司及时更新站区导航标识，做好近端和远端引导，全力服务好旅客返程“最后一公里”。,春节 返京 高峰期,https://news.cctv.com/2023/01/27/ARTIZhy0K8fQTSMp72Qi7ZIJ230127.shtml
2023-01-27 12:16:31,注意！北京大风蓝色预警中，返程请注意安全,今天是五九第一天，但天气依然挺冷。北京市气象台2023年1月27日11时发布：今天下午晴，北风三四级（阵风六七级）转南风二级，最高气温2℃；夜间晴，南转北风二三级，最低气温零下9℃。,返程 北京市气象台,https://news.cctv.com/2023/01/27/ARTIgu33tT55f8NcGATxI3J6230127.shtml
2023-01-27 11:34:43,情暖军烈属丨军地联合给“新时期英雄战士”李向群父母拜年,“李叔叔、王阿姨，给你们拜年啦！”春节前夕，海南省军区、武警海南总队、海口市秀英区政府等军地单位联合组成慰问团，给“新时期英雄战士”李向群父母拜年。,军地联合 李德清 战士,https://news.cctv.com/2023/01/27/ARTI22owB7FfTCBaCoFtFc2V230127.shtml
2023-01-27 11:32:36,国资委发文要求中央企业高质量做好能源保供工作,记者从国务院国资委了解到，国资委近日印发通知，对国资央企坚决打赢能源保供攻坚战、坚决守住能源保供安全底线、更好统筹发展和安全等工作作出部署。,能源 中央企业 电网企业 工作措施,https://news.cctv.com/2023/01/27/ARTIiCqTQzhoP3QubLehh83g230127.shtml
2023-01-27 11:28:45,“中国最冷小镇”：五天近千游客“北上找冷”,近期，“中国最冷小镇”黑龙江省大兴安岭呼中区持续降温，16日以来，-40℃以下天气已达10天，最低温跌至-51.8℃。持续的极寒天气受到“找冷”游客的青睐，21日至25日，近1000名游客到最冷小镇体验泼水成冰、森林穿越等冰雪旅游项目。,游客 中国最冷小镇 大兴安岭,https://news.cctv.com/2023/01/27/ARTIIzaWQfi5v3cxSZfSGkZm230127.shtml
2023-01-27 11:27:24,古法榨糖涅槃重生 “甜蜜”产业助乡村振兴,新春佳节期间，福建省宁德市蕉城区赤溪镇黄田村里，合作社糖蔗种植基地和古法榨糖体验中心随处可见工人收割糖蔗、加工红糖的忙碌身影，空气中糖香四溢。,古法榨糖 乡村治理 村民,https://news.cctv.com/2023/01/27/ARTITIiwMSDnDcn7F6UhjTLP230127.shtml
2023-01-27 11:25:57,广西六堡茶非遗传承人的“南洋梦”,春节前夕，记者来到山坪村探访自治区级非物质文化遗产项目六堡茶制作技艺代表性传承人祝雪兰。山坪村距离梧州市市区80公里，从市区到山坪村驾车需一个多小时。山坪村位于“中国名茶之乡”六堡镇西北部，是瑶族聚居的山村，地处海拔600米以上的山区，终日云雾缭绕，非常适合种植茶叶。,祝雪兰 茶产业 茶船古道,https://news.cctv.com/2023/01/27/ARTIobZu4HCbu2xewomVNFHf230127.shtml
2023-01-27 11:24:45,邮政快递揽收量环比增长37.7%,最新数据显示，1月26日，国家铁路货运继续保持高位运行，运输货物993.6万吨，环比增长2.35%。全国高速公路货车通行159.78万辆，环比增长18.23%。监测港口完成货物吞吐量2468.5万吨，环比增长0.2%,民航保障航班13927班，环比增长6.0%,https://news.cctv.com/2023/01/27/ARTIeqv3lF61y2waNo6cf3zk230127.shtml
2023-01-27 11:24:36,安徽岳西：一年四季都有“茶经济”,冬日暖阳下，走进安徽省安庆市岳西县店前镇的一处茶树良种繁育基地，只见“乌牛早”茶苗绿油油，“黄金芽”茶苗渐泛黄，青黄相接的色块给大别山增添了几抹亮色。,茶苗 岳西县 茶产业,https://news.cctv.com/2023/01/27/ARTI4batlkUaGyY9q8xLgmTW230127.shtml
2023-01-27 11:21:49,新一股冷空气影响中东部地区 全国大部地区降水稀少,受弱冷空气影响，预计27日至28日，中东部部分地区将有4~6℃降温，局地降温超过8℃，上述地区并伴有4~6级风，部分地区阵风达7~8级。我国东部和南部海域将有7～8级风、阵风9～10级。,降水量预报 大部 冷空气 吉林东部,https://news.cctv.com/2023/01/27/ARTI6P0Vg7AB64hbQvlXRYNs230127.shtml
