version_date,title,brief,keyword,url
2023-01-24 09:41:40,寒潮蓝色预警继续发布 过程最低气温25日出现,中央气象台1月24日06时继续发布寒潮蓝色预警：受寒潮影响，预计，1月24日08时至25日08时，黄淮南部、江汉东部、江淮、江南大部、华南、云南东部等地气温将下降6～8℃，其中，浙江东部和南部、福建大部、江西中南部、广东北部等地部分地区气温下降8℃以上，局地降温超10℃。,最低气温 寒潮,https://news.cctv.com/2023/01/24/ARTIr5mQWZYVNTKqJYuASFkL230124.shtml
2023-01-24 09:19:51,1月24日全国铁路预计发送旅客670万人次,澎湃新闻记者从中国国家铁路集团有限公司获悉，1月23日，全国铁路发送旅客522.3万人次，开行旅客列车6683列；1月24日，全国铁路预计发送旅客670万人次，开行旅客列车8013列。,全国铁路 发送旅客,https://news.cctv.com/2023/01/24/ARTIR7fkJjMPHhz01WwJDrau230124.shtml
2023-01-24 07:20:20,变废为宝 这里每年“捕碳”相当于植树近900万棵,如今，山东就有条二氧化碳“变废为宝”产业链。春节前，记者走近这条二氧化碳捕集、驱油与封存一体化应用产业链，一探究竟。,二氧化碳 捕集 植树,https://news.cctv.com/2023/01/24/ARTIhwg2rPWeyN4XHCb2ZAMs230124.shtml
2023-01-24 07:18:53,寒潮来袭 各地多措并举加强春节保供保暖,春节假期，冷空气并未“休假”，一股寒潮正扑面而来。受其影响，我国中东部地区出现明显降温天气。各地各行业采取多种措施积极应对寒潮，充分做好生活物资、交通出行、能源等保障。,留守儿童 寒潮天气 物流园,https://news.cctv.com/2023/01/24/ARTI4RsRkxt4lquXDHO2aNfr230124.shtml
2023-01-24 07:17:05,今年春风行动预计将提供三千万个就业岗位,记者近日从人力资源和社会保障部获悉，2023年1至3月在全国开展的“2023年春风行动暨就业援助月”专项服务活动，预计将为劳动者提供3000万个就业岗位。,就业援助 就业岗位 春风行动,https://news.cctv.com/2023/01/24/ARTI1OCtLp8Be6yaY6hRpsR0230124.shtml
2023-01-24 07:12:14,中国驻洛杉矶总领事馆：美国加州枪击事件有中国公民遇难,驻洛杉矶总领馆发言人就洛杉矶华人社区发生严重枪击事件答记者问。,中国 总领馆 洛杉矶,https://news.cctv.com/2023/01/24/ARTIpp5YZuqJ1ZYcq3q1W8i6230124.shtml
2023-01-24 06:53:50,我国新能源汽车产销连续8年全球第一,中国汽车工业协会最新统计显示，2022年我国新能源汽车持续爆发式增长，产销分别完成705.8万辆和688.7万辆，同比分别增长96.9%和93.4%，连续8年保持全球第一。,新能源汽车 全球领先 汽车销量,https://news.cctv.com/2023/01/24/ARTIDU3JkjsVGI4vsag106dC230124.shtml
2023-01-23 21:49:51,焦点访谈：总书记的牵挂 老胡同 新生活,胡同、四合院，被称为北京的魂，也是这座古城发展变迁的一个缩影。保留胡同的特色，才能让城市留住记忆，让人们记住乡愁。,焦点访谈 老胡同 新生活,https://news.cctv.com/2023/01/23/ARTI2R2dsk4xjO0nHlrDBFCh230123.shtml
2023-01-23 20:57:05,总书记的温暖牵挂,“每逢佳节倍思亲”。新春佳节，我更牵挂基层的干部群众。往年这个时候，我都要到基层走一走，同大家拉拉家常，看看大家还有哪些困难，听听大家新年有哪些打算，分享大家迎接新春的喜悦。今年采取视频连线的方式，看的地方更多，东西南北中都有，虽然隔着屏幕，但我依然能感受到全国各地浓浓的年味，感受到大家的幸福和喜悦，我的心同大家、同全国各族人民的心始终是连在一起的！,中华民族 初心 创新理论,https://news.cctv.com/2023/01/23/ARTIfkMrJzx19j34JIwmFHZU230123.shtml
2023-01-23 20:24:38,医务人员日夜坚守 筑牢百姓健康防线,春节期间，各地医务人员坚守岗位，医药物资生产企业加班加点全力保供，为群众度过一个健康祥和的春节假期提供有力保障。,医务人员 百姓 健康防线,https://news.cctv.com/2023/01/23/ARTIJiUWsDzEpY6HiAtfZWDc230123.shtml
2023-01-23 20:20:50,【新春走基层】广州：花市里的幸福传递,逛花市是广东的春节年俗，广州越秀区西湖花市已有百年历史。今年农历腊月二十八至除夕，中断两年的西湖花市重新开市。接下来，和《新春走基层》记者一起去看看花市里的故事。,新春走基层 广州 花市,https://news.cctv.com/2023/01/23/ARTIYb0mGFx2UzaZXACS4u1z230123.shtml
2023-01-23 20:15:07,丰富观影选择 国产影片发力春节档,国家电影局统计数据显示，截至今天（1月23日）18时，兔年春节档票房已超过20亿元。,国产影片 春节档,https://news.cctv.com/2023/01/23/ARTIZTiYxorYyCv5gtZnswmV230123.shtml
2023-01-23 20:11:31,新春新愿：满满信心 与梦同行,温暖团聚的春节，喜气洋洋的笑脸，大家坐在一起唠唠家常、说说梦想。,新春新愿 满满信心 与梦同行,https://news.cctv.com/2023/01/23/ARTIr5x3Nl4qHZFtBIwIJCDo230123.shtml
