version_date,title,brief,keyword,url
2023-01-24 21:51:57,【总书记的惦念】大凉山的新生活,四川凉山彝族自治州是全国最大的彝族聚居区，也曾是全国集中连片深度贫困地区之一。习近平总书记十分惦记这里的群众，2018年春节前夕，总书记深入大凉山腹地看望贫困群众，深情地说，社会主义就是要让人民过上幸福美好生活。如今，5年过去了，大山深处有哪些新变化？跟随我们的记者去看一看。,总书记 大凉山 新生活,https://news.cctv.com/2023/01/24/ARTIC2AEWJo4Jq6xx3l6HACt230124.shtml
2023-01-24 20:36:18,春运返程客流1月24日起开始增长,“三六九，往外走”，今天（1月24日）是大年初三，随着部分务工客流提前出行，春运返程客流开始增长，全国铁路预计发送旅客670万人次，比昨天增加147.7万人次，全国铁路计划开行旅客列车8013列。,客流 返程 全国铁路,https://news.cctv.com/2023/01/24/ARTIcCegFgjUgxipFdhjJWLc230124.shtml
2023-01-24 20:31:33,坚守一线 落实防疫 健康快乐过大年,春节假期里，各地医护人员继续坚守岗位守护患者，各地景区景点积极落实防疫措施确保游客健康出游。,防疫 过大年 游客,https://news.cctv.com/2023/01/24/ARTIaFZBEoDtGpC2WPZAEOOJ230124.shtml
2023-01-24 20:18:09,【新春走基层】山城小妹送外卖：车轮飞驰 青春飞扬,外卖骑手连接着千家万户，是美好生活的参与者、传递者。今天（1月24日）的《新春走基层》一起来认识外卖骑手廖泽萌。,外卖 青春飞扬 车轮,https://news.cctv.com/2023/01/24/ARTIM0JfRrQwYMjrvMUbAN9c230124.shtml
2023-01-24 20:10:48,农村走亲访友如何做好健康防护？——权威专家解读防疫热点问题,春节假期，人员流动加大，返乡人员增多，农村居民感染新冠病毒的风险加大。农村走亲访友如何做好健康防护？赶集或前往农贸市场、超市有哪些要注意的？针对公众关心的热点问题，国家卫生健康委组织权威专家作出解答。,走亲访友 健康监测 农村居民,https://news.cctv.com/2023/01/24/ARTIQh8AL2GocZdf4BrSk2SP230124.shtml
2023-01-24 20:02:30,新春新愿：稳稳的幸福 满满的期待,新春的中国，大家都喜气洋洋，奋进的中国，人人都朝气蓬勃。,新春新愿 期待 兔年,https://news.cctv.com/2023/01/24/ARTIoPy929D5IZFjm7K3buqM230124.shtml
2023-01-24 19:58:45,欢庆祥和中国年,喜庆祥和的中国年，天南地北的人们赏民俗、品文化，在冰雪运动中体验速度与乐趣，用丰富多彩的方式庆祝新春、乐享假期，欢度美好时光。,表演 遇见未来 乐享,https://news.cctv.com/2023/01/24/ARTIUSeUgRDSBeZR4OGcaLSM230124.shtml
2023-01-24 17:50:53,新年“兔”点啥？跨越时空，兔子们发来祝福！,吉兔呈祥兔在中华文化中自古便是祥瑞之物新年“兔”点啥？跨越时空，兔子们发来祝福！,兔 跨越时空,https://news.cctv.com/2023/01/24/ARTItEzVK0EDO3F1GN0I6PW9230124.shtml
2023-01-24 17:19:47,春节假期 无锡多家景区免费畅游,新春佳节期间，江苏无锡、南京等地的各大景区也开门迎客。市民们赏花灯、品美食、看表演，欢声笑语、人流如织。,春节假期 无锡 免费畅游,https://news.cctv.com/2023/01/24/ARTIheHChFM6qPNKUFS2om17230124.shtml
2023-01-24 17:19:02,正月里来闹新春 北京游园亮点多,在北京，新春游园是不少北京市民正月里必不可少的出游选择。今年北京的各大园区也是亮点不断，热闹红火。,千家万户中国年 北京 游园,https://news.cctv.com/2023/01/24/ARTI492V6Sf1Hn7MriB6zXLd230124.shtml
2023-01-24 17:18:13,国内旅游回暖  体验式过大年受热捧,春节假期前三天，全国群众出游热情高涨。各地文化场馆、旅游景区和街区推出了丰富多彩的体验活动，文化和旅游需求大幅增长，文旅市场快速有序复苏。,国内旅游 体验式过大年,https://news.cctv.com/2023/01/24/ARTINNYSoRPlSOSdv1nzNM8T230124.shtml
2023-01-24 16:52:32,过年 | 海拔2500多米 “披毡战队”踏上冰山护电路,受新一轮冷空气影响，春节期间，贵州西北部海拔2500多米的威宁雪山镇气温降至10年来最低。新春走基层，记者跟随当地一群披着羊毛毡的电力人，踏上了赶往冰山的护电路。,新春走基层 “披毡战队” 护电,https://news.cctv.com/2023/01/24/ARTIb4EHvtkCPqpWk109f3ZC230124.shtml
2023-01-24 16:46:09,消防员提示：遵守燃放规定 勿在可燃物附近点燃烟花,燃放烟花爆竹是人们庆祝新年的方式之一。不过，燃放不当很容易引发火灾。连日来，多地发生了多起此类火情，所幸消防员处置及时，没有造成损失。,燃放烟花 火情,https://news.cctv.com/2023/01/24/ARTIYCzySYpLSfdDuaqZYB3N230124.shtml
2023-01-24 16:45:24,各地消防部门加强排查 保障春节期间烟花燃放安全,今年春节假期，一些城市实行规定时间段全域均可燃放烟花爆竹的政策，国家消防救援局部署各地消防救援队伍，将消防救援力量前置到烟花爆竹燃放点进行流动巡逻巡查，保障节庆安全。,国家消防救援局 消防排查 烟花燃放,https://news.cctv.com/2023/01/24/ARTIncNW4L6CUBt5n5nm4SJB230124.shtml
2023-01-24 16:45:07,中央气象台1月24日18时解除寒潮蓝色预警,中央气象台1月24日18时解除寒潮蓝色预警。,气象台 寒潮 蓝色,https://news.cctv.com/2023/01/24/ARTIXhE5zFqNbeb73vRrsl26230124.shtml
2023-01-24 16:25:41,面向人民生命健康 我国科学家在脑科学领域不断取得重要突破,从基础研究到临床治疗，从生物制药到公共卫生，守护生命健康离不开科技创新。面向人民生命健康，广大科技工作者把增强人民群众的健康福祉作为科技创新的重要方向，潜心科研攻关，不断取得原创性的世界领先成果。,科技强国 哺乳动物 染色体 生物学,https://news.cctv.com/2023/01/24/ARTIuS1t9MGLQTfMqWh6MhTL230124.shtml
2023-01-24 16:12:30,甘肃定西市安定区农民靠发展马铃薯产业致富——“丰收是我们最大的心愿”,李军住在将台村，位于甘肃省定西市安定区鲁家沟镇。“父辈种地靠人力，现在靠的是科技，从播种到收获，都有农机具。”李军皮肤黝黑，说话幽默，“政策也好，肥料补贴80%，地膜补助1/3，越种越觉着前景好，今年接着种咱的马铃薯。”,安定区 马铃薯 定西市,https://news.cctv.com/2023/01/24/ARTI63ByxOEHrrXFJLJtKmhJ230124.shtml
2023-01-24 16:11:32,内蒙古呼和浩特南站——奋战一线畅运输,内蒙古呼和浩特，晚上8点，零下20摄氏度。33岁的列尾作业员于先义完成了巡检打标任务，脸上冻得通红，棉帽上凝结起小冰柱。,列尾装置 于先义 运输安全,https://news.cctv.com/2023/01/24/ARTIVV8HqUYlHeANuvS0015X230124.shtml
2023-01-24 16:10:33,国铁济南局——创新服务暖人心,大年三十，下午6点多，山东潍坊北站，职工滕晓菲虽然不值班，却依然来到候车大厅。一是带着水饺陪陪正在值班的丈夫杨延军，二是看看有没有能帮忙的。,春运 基层 客流高峰,https://news.cctv.com/2023/01/24/ARTIWQSdzTS6fWyeEbnx0jOd230124.shtml
2023-01-24 16:09:06,海南海口美兰边检站——便捷高效通关忙,“201，201，307呼叫！香港至海口HU704航班已降落！”“201收到，307做好接机准备。”执勤二队队长张启迅对着对讲机说完，随即向整装待发的执勤民警下达指令：“上勤！”,美兰 基层 客运航班,https://news.cctv.com/2023/01/24/ARTIhXZmh12Va5nZz2hka8MN230124.shtml
2023-01-24 16:07:29,辽宁葫芦岛团山子变电站——确保城市亮堂堂,大年三十，23时30分，辽宁葫芦岛供电公司220千伏团山子变电站内蜂鸣声不断。值班长丛斌正通过监控系统查看10千伏电压状态、主变负荷以及各线路电流变化。,油位 基层 变电站 红外测温仪,https://news.cctv.com/2023/01/24/ARTIEAUZyhKgyVXHh6hIMeHA230124.shtml
2023-01-24 16:03:54,雄安新区气象新,农民搬进城市新家园，启动区迎来新企业，白洋淀来了更多“新朋友”……这个春节，雄安新区处处涌动新气象。,雄安新区 青头潜鸭 白洋淀,https://news.cctv.com/2023/01/24/ARTIlQPjfdrvlBFTnhGGMNdO230124.shtml
2023-01-24 16:02:13,上海：春节1月21日至23日高速公路流量恢复至2019年92%左右,市交通委指挥中心介绍，春节前三天(1月21日至1月23日)，本市对外交通累计发送旅客74.79万人次，较2022年同期上升76.57%；累计到达旅客46.28万人次，较2022年同期上升127.27%。市内交通累计运送乘客709.74万人次，较2022年同期下降30.74%。,返程 路网 流量,https://news.cctv.com/2023/01/24/ARTInDfUcnptQF5IckK1qhiG230124.shtml
2023-01-24 16:01:26,我国新能源汽车产销连续8年全球第一,中国汽车工业协会最新统计显示，2022年我国新能源汽车持续爆发式增长，产销分别完成705.8万辆和688.7万辆，同比分别增长96.9%和93.4%，连续8年保持全球第一。,新能源汽车 汽车销量 动力电池,https://news.cctv.com/2023/01/24/ARTIqcJLpkfr6TvuUGnyLQIF230124.shtml
2023-01-24 15:39:44,学习进行时｜新春佳节，感悟总书记讲的这“三团”,新春佳节，感悟总书记讲的这“三团”。,学习 新春佳节,https://news.cctv.com/2023/01/24/ARTIWSUDgY8cRQQuOF5OqKUU230124.shtml
2023-01-24 15:13:42,年味正浓 各地流光溢彩贺新春,春节期间，内蒙古、山西、四川等地张灯结彩，夜幕下，流光溢彩、美不胜收。 在广东、浙江、江西等地，当地还举行了烟火表演，让节日氛围更加浓厚。,烟火表演 流光溢彩 贺新春,https://news.cctv.com/2023/01/24/ARTIfcaAbcCttGVDFDjpbJD4230124.shtml
2023-01-24 15:13:09,浙江临海：古城墙上古韵浓 传统年俗人气旺,在浙江临海，古城墙上挂起了红红的灯笼，处处洋溢着新春的气息，丰富的古风表演和年俗活动吸引了众多市民前来观赏。,浙江临海 古城墙 古韵 年俗,https://news.cctv.com/2023/01/24/ARTIAo2eReTGjeSIiRT2KvO0230124.shtml
2023-01-24 15:08:45,过年 | 海外建设者坚守岗位庆新春,新春佳节之际，很多身在海外的中企建设者依然坚守在岗位上。他们也通过多种多样的活动，共庆兔年新春，同时向远在祖国的亲朋好友们表达自己的祝福。,四海同贺中国年 海外建设者,https://news.cctv.com/2023/01/24/ARTIcVS3DY85SlsVTa5GoPox230124.shtml
2023-01-24 14:55:20,各地群众参与冰雪运动热情高涨 尽享冰雪乐趣,眼下正值北京冬奥会结束后的首个冰雪季。去年看冬奥，今年上雪场，春节期间，各地群众参与冰雪运动热情高涨。,春节假期 尽享冰雪乐趣,https://news.cctv.com/2023/01/24/ARTIECV7KfMs17VIKBlzwibz230124.shtml
2023-01-24 14:31:09,全球粮价大涨，我们的“餐桌”会受影响吗？,2022年以来，受乌克兰危机、极端天气、通货膨胀等因素影响，全球粮食价格创下历史新高。分析人士认为，2023年粮食安全危机尚难完全化解，全球谷物价格或将持续高位震荡。,餐桌 粮价波动 全球粮食,https://news.cctv.com/2023/01/24/ARTII1e6QTKXjZYOqNFCXVr2230124.shtml
2023-01-24 14:30:54,春节楼市：“现在不是卖房的好时机，却可能是买房的好时机”,在2023年除夕的前一天，海淀万柳片区的房产中介小谢依然接到了数个客户电话，电话咨询的均是同一套房源——100平米左右、挂牌价1250万的三居室。从楼龄来看，其位于万柳片区“最老的小区”怡秀园，该小区建成于1996年。截至当天，该房源位列链家APP“万柳热搜房源榜”第一。,春节楼市,https://news.cctv.com/2023/01/24/ARTI5sO0eVgaUJjiN0mwXKDs230124.shtml
2023-01-24 14:17:47,香港：金龙巡游贺新岁 香港市民庆新年,大年初二，香港“深水埗·深水情·深连心2023”金龙巡游贺新岁活动启动，为香港的新春佳节增添了浓浓的节日气氛。,喜庆迎新春 热闹过大年 金龙巡游贺新岁,https://news.cctv.com/2023/01/24/ARTIkx2L4NRrc4VgP5gEkqGC230124.shtml
2023-01-24 14:16:29,澳门：龙狮舞动贺新春 市民出游度佳节,春节期间，澳门的大街小巷也是张灯结彩，舞龙舞狮、特色歌舞等丰富活动接连上演，精彩纷呈。,澳门 龙狮舞动 贺新春 佳节,https://news.cctv.com/2023/01/24/ARTI0XwvRxReJ6TrPo6mOnQj230124.shtml
2023-01-24 14:15:58,过年 | 子午岭寻“豹”记,野生珍稀濒危物种华北豹是我国特有的豹亚种，因其身上的花纹，它又被称为金钱豹。最近三年，陇东学院的研究团队一直在甘肃子午岭省级自然保护区对华北豹做调研。,新春走基层 子午岭 华北豹,https://news.cctv.com/2023/01/24/ARTI24x1UfCF5U0UODcfLWwn230124.shtml
2023-01-24 13:10:16,医护人员坚守一线 守护百姓生命健康,在这个春节，很多医护人员都坚守一线。在宁夏，各级医疗机构医护人员不分昼夜，用责任和担当默默守护着人民群众的安全和健康。,医护人员 坚守一线 生命健康,https://news.cctv.com/2023/01/24/ARTIw9YizjHANz8MQdQV7AN5230124.shtml
2023-01-24 13:06:46,海关部门三方面“组合拳”力促外贸保稳提质,稳外贸是确保经济平稳运行的关键之一。记者日前从海关总署获悉，2023年全国海关将在保市场主体、保市场份额、保产业链供应链安全稳定三方面继续发力，全力以赴促进外贸稳规模、优结构。,外贸 海关部门,https://news.cctv.com/2023/01/24/ARTInhJImln05qp2nqeuVvxN230124.shtml
2023-01-24 13:02:28,药品生产企业职工坚守岗位 保障药品供应,今年春节是我国正式对新冠病毒感染实施“乙类乙管”后的第一个春节。随着医药物资需求量的加大，各地医药生产企业春节期间加班加点保证药品供应。,战疫一线 药品 企业 坚守岗位,https://news.cctv.com/2023/01/24/ARTIEGxvnBd6P0c0UJ2YV62d230124.shtml
2023-01-24 12:56:01,过年 | 华龙一号建设者：春节无休保核电建设进度,华龙一号是我国自主研制的第三代核电技术，也是当前我国核电机组发展的主力堆型，目前华龙一号机组正在全国多地展开建设。,大国工程 华龙一号 春节无休,https://news.cctv.com/2023/01/24/ARTIzkLNCt3LAGyBJb0okl8l230124.shtml
2023-01-24 12:54:08,过年 | 海拔4600米高原上的“追光者”,柯拉水光互补电站位于四川省甘孜州，光伏施工面积超1600万平方米，相当于2000个标准足球场连在一起，光伏支架用钢量近5万吨，相当于在4000多米的高海拔地区再造一座“鸟巢”体育馆。,大国工程 追光者 柯拉水光互补电站,https://news.cctv.com/2023/01/24/ARTI8LQv5jxEWuB94hN6S9XS230124.shtml
2023-01-24 12:20:44,加强古城保护 延续历史文脉,党的二十大报告提出“加强城乡建设中历史文化保护传承”。近年来，我国各地古城致力于处理好城市改造开发和历史文化遗产保护利用的关系，切实做到在保护中发展、在发展中保护，不断提升城乡居民的获得感、幸福感，为城市发展和乡村振兴助力。,纪南城遗址 落下闳 凤鸟纹,https://news.cctv.com/2023/01/24/ARTIPM0DMfTQIUwHfGlaMYlw230124.shtml
2023-01-24 12:16:51,指尖绽放的艺术,绒花是以桑蚕丝为主材、金属丝为骨架制作而成的一种手工艺品。绒花，谐音荣华，有着对生活富足顺遂的美好期盼，蕴含着丰富的传统文化内涵。,绒花 艺术形式 宫花,https://news.cctv.com/2023/01/24/ARTIkoqdwzR4paiYTC9ARnZW230124.shtml
2023-01-24 12:14:12,大年初三，睡到饱！,起床or不起床，这是一个问题。好在老祖宗早已留下古训，“初一早，初二早，初三睡到饱”。宅在家里睡到饱，好运福气自然来。,大年初三 被窝,https://news.cctv.com/2023/01/24/ARTIQcABm3vwqzjs7LhY7NMN230124.shtml
2023-01-24 12:10:22,守望团圆，是咱军人过年的方式,"团圆，一个美丽、温馨又让人充满期盼的词语。当火红的灯笼高高挂起，当吉祥的对联贴上门楣，回家团圆的念头，便涌上无数中华儿女的心头。为此，多少人千里辗转、穿越山海，都要与家人“共欢新故岁,迎送一宵中”。对许多人来说，团圆，才是一个幸福年。没有团圆，成就再大也是个缺憾，年味再浓也有些寡淡。",人民军队 海军官兵,https://news.cctv.com/2023/01/24/ARTITKUBSLcVxn8quMp9KJht230124.shtml
2023-01-24 12:06:25,新春走军营丨智守边关，在风雪中洗礼卫国戍边赤子心,新春佳节，雪域高原处处张灯结彩。西藏军区某边防连的哨楼门前，一副官兵自己写的春联道出戍边人心声——“风雪无阻甘当戍边基石，耳聪目明争做合格卫士。”,风雪 军营 边关 连队,https://news.cctv.com/2023/01/24/ARTIOMXR0uNlU6TcisYYYRKM230124.shtml
2023-01-24 11:58:34,人民的春晚盛满中国韵味,在万众瞩目中，中央广播电视总台2023年春节联欢晚会如约而至，成为全球华人的文化年夜饭。今年，总台春晚坚守中华文化立场，坚持以人民为中心，以浓浓中国味、暖暖中国情、美好中国梦，让人民的春晚绽放出“最中国”的神韵与光彩。,人民 春晚节目 中华,https://news.cctv.com/2023/01/24/ARTIr5ZmkXEGf7Jw3mWlJQXn230124.shtml
2023-01-24 11:57:27,“阳康”之后进补不宜过猛,近来，网友关心“阳康”之后要继续用药巩固疗效吗？北京大学第三医院妇产科主任赵扬玉解释：“新冠感染以后，服药治疗主要针对发热、腹泻、咳嗽等一些症状，但药物一方面起治疗作用，同时还有一定的副作用。如果这些症状都消失了，应该及时停药。”,阳康 进补 高脂血症,https://news.cctv.com/2023/01/24/ARTIqkjqre28M5SuAGU6joM2230124.shtml
2023-01-24 11:55:21,时习之 总书记的温暖牵挂｜“在推动航空科技自立自强上奋勇攀登”,科技是国家强盛之基，党的十八大以来，习近平总书记行程万里、初心如一，考察足迹遍布大江南北，始终关注科技自立自强。人民网·中国共产党新闻网推出“习近平的温暖牵挂”系列策划之科技创新篇，回顾总书记对航空事业发展的高度重视。,自立自强 航空科技 科技创新,https://news.cctv.com/2023/01/24/ARTIHIwp9sbff1cxpFdPQvry230124.shtml
2023-01-24 11:53:33,情暖中国：总书记的新春足迹,1月18日，习近平总书记在视频连线看望慰问基层干部群众时深情地说：“新春佳节，我更牵挂基层的干部群众。”党的十八大以来，每逢农历新年前夕，习近平总书记总会到基层看望慰问广大干部群众，同群众一起拉家常、问冷暖，送去最暖心的祝福。总书记的关怀与祝福，传递到祖国四面八方，温暖着中华各族儿女。党建网梳理了习近平总书记近十多年来的新春足迹，邀您一起回味和感悟人民领袖与人民群众间的鱼水深情。,干部群众 基层干部 基层治理,https://news.cctv.com/2023/01/24/ARTIJV7Laec3MSy8sQPQn7BT230124.shtml
2023-01-24 11:30:22,过年 | 数百名工作人员坚守岗位 守护美丽黄山,春节假期，万家团圆，在安徽黄山风景区，仍有许多工作人员默默坚守岗位，保障游客们的假期游览，守护着景区的一山一石一草一木。,安徽黄山风景区 坚守岗位,https://news.cctv.com/2023/01/24/ARTILqgEhCgM91GtSTHzZtHh230124.shtml
2023-01-24 11:30:11,两天收获超28亿元票房 兔年电影春节档为什么这么火？,春节档历来被视作全年电影市场的风向标，受疫情影响沉寂多时的中国电影在今年春节档全面发力。国家电影局统计数据显示，截至今天（1月24日）零点，兔年电影春节档用两天时间取得了超28亿元的成绩。,兔年 电影 春节档 票房,https://news.cctv.com/2023/01/24/ARTI8mgjHrpkWIRdRqA88YE1230124.shtml
2023-01-24 11:21:12,特色产业融合发展 助力乡村振兴,产业兴则乡村兴。近年来，各地立足区域资源优势，因地制宜调整产业结构，不仅拓宽了群众增收致富的渠道，也助力乡村振兴发展。,特色产业 融合发展 乡村振兴,https://news.cctv.com/2023/01/24/ARTId9Evc4INWlA14JwfkIm3230124.shtml
2023-01-24 11:12:08,春运 | 各地铁路部门采取措施 温暖旅客回家路,昨天，全国铁路预计发送旅客475万人次，开行旅客列车6683列。各地铁路部门采取措施，温暖旅客回家路。,2023年春运 铁路,https://news.cctv.com/2023/01/24/ARTIcwbVNToiGNpAOsYf4hWg230124.shtml
2023-01-24 11:11:25,寒潮来袭 交通部门调集运力保电煤运输,这几天，随着全国多地气温走低，各地交通部门也采取措施，保障电煤运输。,寒潮 交通部门 电煤运输,https://news.cctv.com/2023/01/24/ARTIQbY4NR1n9rongs5dwkJv230124.shtml
2023-01-24 11:03:18,春运丨1月23日发送旅客2352.5万人次 全国高速路小客车流量4324.7万辆次,1月23日发送旅客2352.5万人次，全国高速路小客车流量4324.7万辆次。,春运,https://news.cctv.com/2023/01/24/ARTIQYuH4f2RO0PugzREpYU5230124.shtml
2023-01-24 10:56:46,各族人民幸福安康 伟大祖国繁荣昌盛,春节假期，万家团圆。人们走亲访友、购物旅游、运动健身，在欢声笑语中共度幸福年。,民俗 早市 离岛,https://news.cctv.com/2023/01/24/ARTIEiWDcqnbg8JlzblGPjFf230124.shtml
2023-01-24 10:53:10,兔兔你好！接下来的一年请多多关照,兔兔你好！接下来的一年请多多关照.,兔年 虎年 十二生肖,https://news.cctv.com/2023/01/24/ARTIxkxKSXi7I2MSdv8huULx230124.shtml
2023-01-24 10:53:06,人民的春晚盛满中国韵味,在万众瞩目中，中央广播电视总台2023年春节联欢晚会如约而至，成为全球华人的文化年夜饭。,春晚节目,https://news.cctv.com/2023/01/24/ARTIjVpnwiLgDO8flLjulV4I230124.shtml
2023-01-24 10:49:59,创新艺术表达 赓续民族精神——中央广播电视总台2023年春晚观感,卯门生紫气，兔岁报新春！,春晚 总台,https://news.cctv.com/2023/01/24/ARTIG9swQHhMDr0M2mz99R7V230124.shtml
2023-01-24 10:36:54,2022年楼市十大关键词：从“四限松绑”到“一人购房全家帮”,2022年是房地产市场深度调整的一年。在疫情冲击及居民预期收入下降背景下，部分购房需求延迟释放；同时，房企信用危机频频爆发，购房者观望情绪渐浓，销售端表现乏力。,房企 楼市 政策优化,https://news.cctv.com/2023/01/24/ARTIisEe4R5Z7A2CL7qQSXDG230124.shtml
2023-01-24 10:35:42,长三角铁路迎节后客流小高峰 1月24日预计发送旅客115万人次,今日是正月初三，长三角铁路将迎来节后客流小高峰，当日预计发送旅客115万人次。,发送旅客 客流 长三角,https://news.cctv.com/2023/01/24/ARTIfbDC97v60H5Sv8NClYBy230124.shtml
2023-01-24 10:24:31,稳稳的幸福年｜“一根针”串起的美好生活,社区虽小，却连着千家万户，能够最直接、最敏锐地感知居民对美好生活的向往。,幸福年 一根针 美好生活,https://news.cctv.com/2023/01/24/ARTIISzr5COIAclU0JNMbQaB230124.shtml
2023-01-24 10:23:24,过年 |  一年时光半年冬 零下30℃官兵坚守祖国北大门,黑龙江省黑河市是我国的高寒地区之一，这里有着“一年时光半年冬”的说法。北部战区陆军某边防旅“黑河好八连”的官兵常年驻守在里，春节期间，他们不忘战备，又一次踏上了巡逻路，忠诚守卫着祖国的北大门。,黑龙江 一线巡逻 黑河好八连,https://news.cctv.com/2023/01/24/ARTICmChY8AB1N3C7PvfYzx1230124.shtml
2023-01-24 10:11:28,文旅部：进一步加强春节期间旅游安全工作，加强各类安全风险隐患检查排查,2023年春节假期进入第三天，假日市场迎来客流高峰。近期多地发生涉游客安全事件，给行业安全生产工作发出警示。,错峰 旅游安全 旅游经营,https://news.cctv.com/2023/01/24/ARTIiknE6rovAbmJ9tEOF0xu230124.shtml
2023-01-24 10:09:37,广西多措并举 应对出入境客流高峰,今年春节假期，广西南宁口岸出入境客货航班预计将达到约160架次。南宁出入境边防检查站多措并举，确保旅客出行安全有序。,出入境客流高峰 南宁口岸,https://news.cctv.com/2023/01/24/ARTINaILXrJFz3i8z1KharKu230124.shtml
2023-01-24 10:09:01,过年 | 河南新乡“新医生”的除夕故事,在河南省新乡医学院第三附属医院的病房里，张东颖这位刚刚毕业半年的年轻医生忙碌地穿梭在病床之间。除夕这天正好是她28岁的生日，坚守一线的她，让青春之花绽放在抗疫一线。,河南新乡 除夕故事 新乡医学院,https://news.cctv.com/2023/01/24/ARTIP8JJDwXyn24pwfqTgpLN230124.shtml
2023-01-24 10:07:48,加强基层医疗服务 守护百姓健康,新冠病毒感染调整为“乙类乙管”后，如何保障中老年群体的健康安全成为重中之重。眼下正值新春佳节，在浙江德清县新市镇，村里的医生们走村串户，用心用情守护村民的身体健康。,基层医疗服务 百姓健康,https://news.cctv.com/2023/01/24/ARTIITX0AXZDwYW2dBIh63G1230124.shtml
2023-01-24 10:07:17,春节期间药械供应稳定 全力守护百姓健康,春节期间，人员流动增加，各地加强防疫物资和药品供应配备，保障群众健康需求。,战疫一线 春节期间 药械供应,https://news.cctv.com/2023/01/24/ARTIukr503DMP8VgP4vs0Q9p230124.shtml
