version_date,title,brief,keyword,url
2023-01-27 21:50:47,焦点访谈：总书记的牵挂 化屋新春,本期节目我们将跟随总书记的足迹去往贵州毕节黔西市新仁苗族乡化屋村，这里曾经是国家级的深度贫困村，贫困的发生率一度超过了60%。近些年，基础设施的不断完善和特色产业的发展为化屋村带来了蝶变，2019年，化屋村整村脱贫，两年后，2021年春节前，习近平总书记在贵州慰问考察，他的第一站正是毕节新仁苗族乡化屋村。,焦点访谈 总书记 牵挂 化屋新春,https://news.cctv.com/2023/01/27/ARTIGU89DE0AHog7W9arK0Mg230127.shtml
2023-01-27 20:35:16,四海同贺兔年新春 共期美好未来,新春佳节之际，我驻联合国机构及多国大使馆以多种形式欢度新春佳节。多国人士送上新春祝福，希望在新的一年里同中国加强合作，共创美好未来。,兔年新春 美好未来,https://news.cctv.com/2023/01/27/ARTIUaiUElo6URK0aA1RYqzZ230127.shtml
2023-01-27 20:29:07,春运迎来返程客流小高峰,今天（1月27日）是春节假期最后一天，春运迎来返程客流小高峰。全国铁路今天预计发送旅客1210万人次，其中长三角地区客流量约193万人次。务工客流集中的阜阳站今天加开临客列车33列。,春运,https://news.cctv.com/2023/01/27/ARTIMiNIwM4NnAJkN7GUk7Bj230127.shtml
2023-01-27 20:26:28,春节假期全国国内旅游出游3.08亿人次,根据文化和旅游部数据中心测算，今年春节假期，全国国内旅游出游3.08亿人次，同比增长23.1%；实现国内旅游收入3758.43亿元，同比增长30%。,春节假期 国内旅游,https://news.cctv.com/2023/01/27/ARTItQSuQEvhJCeYgRhR2Y9W230127.shtml
2023-01-27 20:23:36,新春新愿：努力向前 共创美好未来,春节海采《新春新愿》一起分享愿望，感受这些新愿背后大家向上的精气神和不断向前的冲劲儿，愿每个人兔年都能够皆得所愿。,新春新愿,https://news.cctv.com/2023/01/27/ARTIRdhBacLgivHmwwZBEhdP230127.shtml
2023-01-27 20:22:00,多姿多彩乐享假期,春节假期，各地旅游消费市场火热，人们的假日生活丰富多彩。,乐享假期,https://news.cctv.com/2023/01/27/ARTIaWMmwy2QfoRGPBEG4Hfu230127.shtml
2023-01-27 20:16:25,【传感中国】千里送花 一路余香,过年，很多人会送上礼物表达祝福。新年以来，单日邮政快递投递量的最高峰已经超过4亿件。今天，我们就跟随其中的一盆牡丹花，来看看鲜花的千里保鲜路。,传感中国,https://news.cctv.com/2023/01/27/ARTIXZlcCnQeqVlYiV5WNNpw230127.shtml
2023-01-27 20:11:11,【新春走基层】节日期间重大工程稳步推进,新春佳节，一批重大交通基础设施工程稳步推进。今天（1月27日）的《新春走基层》我们一起前往重大工程现场，记录一线建设者忙碌的身影，感受他们的奋斗热情。,新春走基层 重大工程,https://news.cctv.com/2023/01/27/ARTIWgV4JwQ6gAKUa80iyu9X230127.shtml
2023-01-27 20:03:39,【总书记的惦念】走上乡村振兴幸福路,2021年春节前夕，习近平总书记来到贵州省毕节市黔西化屋村考察。他走进苗族村民家和扶贫车间，点赞古老苗绣，叮嘱乡亲们脱贫之后，要接续推进乡村振兴，要把包括苗绣在内的民族传统文化传承好、发展好。,总书记的惦念 乡村振兴,https://news.cctv.com/2023/01/27/ARTIGVfx9kWuZTnPZhKQd151230127.shtml
2023-01-27 19:20:26,习近平致电祝贺达达埃当选连任巴布亚新几内亚总督,1月27日，国家主席习近平致电鲍勃·达达埃，祝贺他当选连任巴布亚新几内亚独立国总督。,习近平,https://news.cctv.com/2023/01/27/ARTIlwBhNUVQpX1RqxPTC8Sm230127.shtml
2023-01-27 19:11:21,假期不停工，重点项目“加速跑”,春节本是阖家团圆的时刻，然而在菏泽市长江路转体桥项目施工现场，广大建设者主动放弃与家人团聚的机会，坚守一线，抢抓工期，加班加点不停工，坚守岗位保进度。,菏泽长江路转体桥项目 春节,https://news.cctv.com/2023/01/27/ARTI2HozMueDMdxEsOUaBWh3230127.shtml
2023-01-27 19:10:21,文化和旅游部：春节假期全国国内旅游出游3.08亿人次,经文化和旅游部数据中心测算，今年春节假期全国国内旅游出游3.08亿人次，同比增长23.1%，恢复至2019年同期的88.6%。实现国内旅游收入3758.43亿元，同比增长30%，恢复至2019年同期的73.1%。春节假日全国文化和旅游市场总体安全平稳有序。,旅游景区 旅游部 国内旅游 旅游消费,https://news.cctv.com/2023/01/27/ARTI7Q7jb19kWfd5rwYa60RM230127.shtml
2023-01-27 18:55:51,【过年】习言道｜我们的生活也是这样，越过越好！,春节是中华民族传统节日，是万家团圆、辞旧迎新的喜庆日子。让我们重温习近平总书记与人民群众一起过年的暖心故事。,习言道 人民群众 中华民族,https://news.cctv.com/2023/01/27/ARTIoQrMGO4isJCP9wHhjfdE230127.shtml
2023-01-27 18:48:47,《2023中国诗词大会》登场：与时代偕行，让荧屏诗意常青,时光飞逝，《中国诗词大会》自2016年推出至今，已走到第八个年头。,2023中国诗词大会,https://news.cctv.com/2023/01/27/ARTINGfr9PVCVHJ9wdbGV1xT230127.shtml
2023-01-27 17:54:05,文化和旅游部：2023年春节假期国内旅游出游3.08亿人次,经文化和旅游部数据中心测算，今年春节假期全国国内旅游出游3.08亿人次，同比增长23.1%，恢复至2019年同期的88.6%；实现国内旅游收入3758.43亿元，同比增长30%，恢复至2019年同期的73.1%。春节假日全国文化和旅游市场总体安全平稳有序。,文化和旅游部 春节假期 国内旅游,https://news.cctv.com/2023/01/27/ARTIoZVwpcRfRmKOF54Uucn4230127.shtml
2023-01-27 17:52:40,习近平致电祝贺达达埃当选连任巴布亚新几内亚总督,1月27日，国家主席习近平致电鲍勃·达达埃，祝贺他当选连任巴布亚新几内亚独立国总督。,习近平,https://news.cctv.com/2023/01/27/ARTI9TSgCkTUMxHAi7FlPS5i230127.shtml
2023-01-27 17:47:22,返程车流影响，江苏多条高速公路实施临时管控措施,据江苏省交通运输厅官方微博消息，截至1月27日16:00，全省高速公路总体运行平稳，通行秩序良好，受春节假期返程车流影响，部分路段车流量较大，有阶段性车多缓行情况。,返程车流 江苏 高速公路 临时管控,https://news.cctv.com/2023/01/27/ARTICbGQIkE3cIEYQNvYNBfW230127.shtml
2023-01-27 17:33:03,海口码头迎返程高峰 车辆排队登船过海,春节假期临近尾声，海口各港口迎自驾游车辆返程过海高峰。,海口 码头 返程 高峰 车辆 排队 登船,https://photo.cctv.com/2023/01/27/PHOAAPiE0SOuDECNZlaOpWg4230127.shtml
2023-01-27 17:27:22,国航回应“一航班颠簸下坠”：受气流影响出现短时颠簸，无人员受伤,据@中国国际航空 微博1月27日发文表示，2023年1月25日国航CA8524航班（西安-温州）飞行中出现颠簸的情况在网络上受到较高关注，国航对此高度重视，迅速开展调查。,国航 航班 颠簸,https://news.cctv.com/2023/01/27/ARTIcysNo76s5JRoHOnr9VYg230127.shtml
2023-01-27 17:26:55,旅游市场持续升温 品味浓浓中国年,央视网消息：千家万户中国年，喜庆祥和、丰富多彩。在辽宁、四川、浙江等地新春庙会热闹上演，一起去看看。在辽宁沈阳的老北市庙会上，传统民俗、高科技演艺等为游客带来沉浸式体验。台湾游客：我觉得这庙会太热闹了，带小孩子出来玩很有那个新年的感觉，觉得这里人都很热情，东西也非常好吃。热乎乎的年味美食、火辣辣的东北戏、暖烘烘的关东情，融炼出一道独特的东北年俗文化体验。据了解，沈阳老北市庙会从大年初一开放至正月十五。四川雅安：逛庙会 寻年味 欢欢喜喜过大年在四川雅安的西康庙会上，舞狮子、踩高跷、川剧变脸等独具传统文化特色的表演精彩纷呈，特色美食令人大饱口福，喜庆热闹的氛围吸引了不少游客拍照记录。市民 魏云：看,喜庆闹新春 老北市庙会年味浓,https://news.cctv.com/2023/01/27/ARTIZKJ0ppPqWyOhJxZ1vaHw230127.shtml
2023-01-27 17:26:11,“点对点”送工服务 广西开出今年首趟务工人员返岗专列,昨天（1月26日），广西也开出今年首趟务工人员返岗专列。600多名务工人员在粤桂两省区人社部门的组织下，以“点对点”的形式，从广西桂林北站乘动车至广东深圳返岗务工。,广西 开出今年首趟务工人员返岗专列,https://news.cctv.com/2023/01/27/ARTIkIDJWKfPeEHzaDfNh51U230127.shtml
2023-01-27 17:25:55,从家乡直达上班地 四川今年首趟“务工专列”发车,今天凌晨（1月27日），载有1200多人的K4231列车从四川达州站驶出，预计明天早晨8点左右到达广州站。这也是四川今年开出的首趟务工人员返岗专列。,四川今年首趟“务工专列”今日发车,https://news.cctv.com/2023/01/27/ARTIwyM4zgEvghUpSgLRhDZn230127.shtml
2023-01-27 17:25:43,多彩民俗年味浓 特色活动贺新春,俗话说，不出十五都是年。尽管春节假期接近尾声，但各地年味儿不减。  品民俗，逛灯会，大家用丰富多彩的方式庆祝新春，欢度佳节。,多彩民俗年味浓 特色活动贺新春,https://news.cctv.com/2023/01/27/ARTI4SfJngVtL5PKGuPl1Yni230127.shtml
2023-01-27 17:02:23,北京：春节假期日均进出京客流58.68万人次,春节假期，交通部门全力做好假日交通保障工作。全市交通运行总体平稳有序。铁路、民航、省际客运日均进出京客流58.68万人次，较2022年同期增长278.58%，较2019年同期下降31.40%。,北京 春节假期,https://news.cctv.com/2023/01/27/ARTIjRpTPd7TwllqYupjmN9s230127.shtml
2023-01-27 16:45:58,时习之 关于家庭家教家风建设 从总书记的论述中感悟真情与大义,家是最小国，国是千万家。习近平总书记多次在讲话中谈到“要推动全社会注重家庭家教家风建设”，身体力行倡导中华民族的优良传统，推动社会主义核心价值观在家庭落地生根。,家教 总书记 家风 论述,https://news.cctv.com/2023/01/27/ARTIqA7A29vKTBvKbubXAJy0230127.shtml
2023-01-27 16:38:05,北京铁警多措并举应对春节返程高峰,1月27日是春节假期最后一天，北京地区全天预计到达旅客60.1万人。针对节后返程高峰，北京铁路公安局提前部署警力，全面净化站区治安环境，确保返程旅客安全。,北京铁警 春节返程高峰,https://news.cctv.com/2023/01/27/ARTILCYoaAAoo5eJyrwWCBMq230127.shtml
2023-01-27 16:33:58,年味浓 消费旺,春节假期，各地消费、旅游市场人气旺。人们外出游玩，品美食、逛集市、看电影等，品味浓浓年味。,年味浓 消费旺 春节 假期,https://photo.cctv.com/2023/01/27/PHOAhyX90abc2OJN6bkmFBoo230127.shtml
2023-01-27 16:26:27,春节消费强劲 各地商业餐饮火爆,这个春节，各地各大商圈人气也非常旺盛，人们外出购物、就餐、娱乐热情高涨，不少餐饮门店排起长队。,春节消费强劲 商业餐饮火爆,https://news.cctv.com/2023/01/27/ARTIZhWIWQYSIcHcIBq8m9w9230127.shtml
2023-01-27 16:26:15,流动的中国充满活力 中国的喜庆温暖世界,机场、火车站排起的长队，商场、街头挂起的大红灯笼，旅游景点攒动的人群，热气腾腾的年夜饭……作为中国最重要的传统佳节，春节成了世界观察中国的一扇窗。目睹一片欢腾，有外媒感叹“看到一个充满活力、生机盎然的中国”，也有外国网友认为“中国春节的热闹景象温暖了世界”。《新春观察》今天来看《中国的喜庆温暖世界》。,流动的中国充满活力 中国的喜庆温暖世界,https://news.cctv.com/2023/01/27/ARTIdou8AdJUPnrdiHJrlLyz230127.shtml
2023-01-27 16:19:55,年味浓浓 日子红火,灶台里柴火烧得通红，锅中油开始翻滚沸腾，一盆莲藕肉馅已备在台面上……大年三十下午，安徽宣城，台湾同胞邱诗晴麻利地系上围裙，手指翻转间，一粒肉丸在指尖成形，滑入锅中。几分钟后，“炸圆子出锅喽！”丈夫李松在身旁打下手。,邱诗晴 福建特产 圆子,https://news.cctv.com/2023/01/27/ARTIzDgpIZrqnnNN2vgb6JX5230127.shtml
2023-01-27 16:19:02,村晚欢庆新年 非遗促进发展,春节前夕，山东省东营市垦利区兴隆街道东安社区的文化广场上，人头攒动，热闹非凡。黄河大秧歌、山东吕剧、舞狮表演、原创快板等12个节目各有特点，为群众奉上一场精彩的村晚。,非遗 草编 传统中医,https://news.cctv.com/2023/01/27/ARTIVEokBf6LGA3D5Xw08CxG230127.shtml
2023-01-27 16:15:13,建党群服务中心 关怀新就业群体,“嘿，让一让。”临近年三十，记者来到上海市普陀区新村路661号的一处外卖配送站点。还没进院，身前身后就传来外卖骑手忙着赶路的声音，好不忙碌。,党群 就业 外卖 基层,https://news.cctv.com/2023/01/27/ARTIvkqq0knjm3TK5I7KNt6X230127.shtml
2023-01-27 16:09:37,发展奶牛养殖 种养加一体化,数九寒天的内蒙古自治区呼伦贝尔市阿荣旗，虽然天寒地冻，但室内很温暖，别有一番洞天。走进天兴牧场，犊牛岛成为一道独特的风景。,阿荣旗 奶牛养殖 牛场,https://news.cctv.com/2023/01/27/ARTIZ2rumMrnKdsUeNhPFcqD230127.shtml
2023-01-27 16:08:53,大医院“沉下去” 网格员忙起来,1月中旬，记者来到山西省介休市宋古乡卫生院。在2000平方米的康复大厅里走一圈，各种康复器械一应俱全，不同的治疗区划分清晰，两边墙上挂着近30面锦旗。,网格员 慢性病 宋古乡,https://news.cctv.com/2023/01/27/ARTIhmA4HcYnLJejXmOLl16n230127.shtml
2023-01-27 16:08:36,春节假期前六天全国移民管理机构查验出入境人员239.2万人次,1月21日至26日，全国移民管理机构共查验出入境人员239.2万人次，较去年春节同期（2022年1月31日至2月5日）增长123.9%。其中，入境120万人次，较去年春节同期增长127.2%；出境119.2万人次，较去年春节同期增长120.7%。查验出入境交通运输工具10.9万架（艘、列、辆）次，较去年春节同期增长62%。,春节假期 移民管理机构 出入境,https://news.cctv.com/2023/01/27/ARTIX5qllMV0vkvFPMXuxLUN230127.shtml
2023-01-27 16:08:03,工作群里看援藏干部的坚守,“嘀嘀嘀……”春节期间，辛作伟的手机响个不停，显示的却不是拜年信息。“咱们的青稞八宝饭销量已经超过1万份！”一名同事在工作群中汇报着成绩。辛作伟是上海市第十批援藏干部，日喀则珠峰文化旅游投资发展集团有限公司副总经理。这是上海援藏联络组和企业共同打造的一款公益商品，将对口支援地日喀则的青稞混合土豆培根，制成一碗咸中带甜的八宝饭。,青稞 八宝饭 援藏干部,https://news.cctv.com/2023/01/27/ARTIE7n26OQSBTIR8R5OmVJB230127.shtml
2023-01-27 16:06:58,果园中听科技特派员的心声,这个春节，重庆市巫山县果业中心副主任、巫山县科技特派员黄明一直很忙，一大早就从县城往村里赶，在路上向记者说：“现在是脆李冬管的关键时候，今年果子的品质，就看这个冬天了。”,科技特派员 果园 巫山县,https://news.cctv.com/2023/01/27/ARTIQrNNPGlDkS0AlBjU13H1230127.shtml
2023-01-27 16:05:58,政府带团做后援 跨海赶集拓市场,“抢到啦！”一见面，浙江盛发纺织印染公司业务经理史颖就报上喜讯。1月20日，赴德国参展归来，来不及倒时差，史颖早早来到公司梳理“战果”：拿下70万美元的新订单，相当于近160万米布，能装满10个集装箱。,赶集 外贸企业 纺织印染,https://news.cctv.com/2023/01/27/ARTIQbMIU4yXJcSV2vFVI7dB230127.shtml
2023-01-27 16:04:16,信号保畅通 风雪亦无阻,由101名平均年龄不到27岁的年轻人组成的省市两级监控调度团队，承担着黑龙江省内4万座通信基站7×24小时监控任务，他们对接的1500多名通信基站维护人员随时待命。,通信基站 油机 监控中心,https://news.cctv.com/2023/01/27/ARTIT9ST3cWjXODMiLJ5FBHL230127.shtml
2023-01-27 16:03:24,行雨林深处 护绿水青山,春节假期，阳光照进村庄。海南热带雨林国家公园鹦哥岭保护区南开管理站护林员符惠全一如既往起了个大早，跨上摩托车，和同伴们向雨林深处驶去，开始一天的巡山工作。,鹦哥岭 国家公园 护林员,https://news.cctv.com/2023/01/27/ARTIujSmwCommPR86cTVcQP2230127.shtml
2023-01-27 16:02:28,调度运行稳 电煤运输忙,夜幕下，海水拍打着渤海湾的海岸。晚上6时30分，程宝刚迈着轻快的步伐，走进河北港口集团秦皇岛港九公司集控中心。这个春节，作为集控中心乙班值班主任，程宝刚丝毫不敢懈怠，与班组的10名同事一起坚守在电煤运输一线。,电煤运输 远程集中控制 调度运行,https://news.cctv.com/2023/01/27/ARTILNxFgO3KcBV2A4LKgfxv230127.shtml
2023-01-27 16:01:34,幸福花开又一春,新春到，年花俏。农历腊月二十八下午3点，云南昆明市民何秀珍专程到斗南花卉市场挑选年宵花，为春节增色添彩。每到春节，玫瑰、百合、冬青、蜡梅等年宵花都备受追捧。,斗南 花卉市场 蝴蝶兰,https://news.cctv.com/2023/01/27/ARTI9y05SIQD3eviz0S2Nixm230127.shtml
2023-01-27 16:00:42,桥高路畅促发展,施工电梯贴着桥塔缓缓上升，在顶部稳稳停住。推开电梯门，刘豪一步跨上近200米高的桥塔平台，向下俯瞰，北盘江在贵州花江大峡谷间流淌。,坝陵河 山区桥梁 花江大峡谷,https://news.cctv.com/2023/01/27/ARTIJTIEdO236oYbXUEiVgdi230127.shtml
2023-01-27 15:59:19,春运里的中国，充满勃勃生机,春运是实现万家团圆的幸福旅程，也是观察中国经济的一扇窗口。疫情防控进入新阶段后的第一个春运，格外受人关注。,春运 大年初五 崇礼,https://news.cctv.com/2023/01/27/ARTIyiMAJ66gDHev2p1OqDPG230127.shtml
2023-01-27 15:58:39,金沙绿电送万家,2023年春节，是白鹤滩水电站全面投产后的第一个春节。从紧锣密鼓的配套建设、高效运行的供电保障，到有条不紊的生态保护，白鹤滩的春节和平时一样，忙碌而有序。,白鹤滩水电站 地下洞室群 分层取水,https://news.cctv.com/2023/01/27/ARTI63F2VLG1XrBKtM6bL0ol230127.shtml
2023-01-27 15:57:12,农旅融合游客多,大年初五，湖北省宜昌市兴山县水月寺镇安桥河村，海拔1300多米的三峡云栖谷国际滑雪场里，24岁的滑雪爱好者王宗燊踩着雪板，身体微微下蹲，脚下用力，沿着坡道滑了起来。“去年兴山通了高铁，从武汉过来滑雪只要3个多小时，很方便。”王宗燊说。,游客 景区 基层 村民,https://news.cctv.com/2023/01/27/ARTIpIR7O4rDUy3XRqreQwA8230127.shtml
2023-01-27 15:55:34,冰雪天地年味浓,长达512.6米的冰滑梯上，满是游人的欢笑声；400米长的雪雕墙面生动立体，雕琢了历史经典故事；园区中心39米高的冰雕塔顶，一只灵动可爱的玉兔和着乐声旋转不停……,滑雪场 冰雪资源 旅游,https://news.cctv.com/2023/01/27/ARTIn7caZRgGyN5GtZRKfqgq230127.shtml
2023-01-27 15:52:32,让老乡们过好团圆年——陕西乡村疫情防控见闻,大年初四，82岁的陕西省周至县马召镇富饶村村民任文博，接到了来自村医刘学军的新春第一通电话。简短拜年后，刘学军详细了解起任文博的身体状况，得知老人精神尚好。“这两天天气冷，一定保暖好不要感冒。春节饮食上不能吃过饱，对心脏和血压不好。”刘学军嘱咐说。,疫情防控 马召镇 刘学军,https://news.cctv.com/2023/01/27/ARTIXNgDlIbMRHVb36s6TOt7230127.shtml
2023-01-27 15:50:36,开辟发展新领域新赛道,习近平总书记在党的二十大报告中指出，必须坚持科技是第一生产力、人才是第一资源、创新是第一动力，深入实施科教兴国战略、人才强国战略、创新驱动发展战略，开辟发展新领域新赛道，不断塑造发展新动能新优势。,巢湖明月 风电机组 动能,https://news.cctv.com/2023/01/27/ARTIHDJEUpmeHT0FgxYjw5I0230127.shtml
2023-01-27 15:48:35,坚定发展信心 努力做优做强,暖阳里，云南昆明的云天化晋宁现代花卉产业园内千亩玫瑰含苞待放。9米高的大棚，每个占地100多亩，却只需1人管理。徜徉花海，云天化花匠铺科技公司综合管理部副部长王博介绍：“水肥、环境、温度，都是自动化控制，花产量比传统大棚翻了两番。”,云天化集团 肥料 绿色矿山,https://news.cctv.com/2023/01/27/ARTI1taiVONMJb7QDN3Y639l230127.shtml
2023-01-27 15:46:07,兔年伊始，看23个仅回家可见的过年故事,大年初六，假期最后一天，回家的人们已陆续踏上返程路。十兄妹聚齐打地铺，妈妈夜里给儿子串鞋带，比身高、发红包、再照张全家福…网友众筹23个过年回家的故事，收藏属于这个年的“仅回家可见”，带着家满满的力量，再出发！,过年回家 兔年 返程路,https://news.cctv.com/2023/01/27/ARTIyTOQRhCNjA0wgURXfpLI230127.shtml
2023-01-27 15:44:16,时习之 总书记的温暖牵挂｜“我预祝你们成才”,教育是国之大计，党之大计。党的十八大以来，习近平总书记行程万里、初心如一，考察足迹遍布大江南北，始终高度重视青少年的教育发展。人民网·中国共产党新闻网推出“习近平的温暖牵挂”系列策划之教育发展篇，回顾总书记对陕西省榆林市绥德实验中学孩子们的殷殷寄语。,初心 中国共产党 绥德,https://news.cctv.com/2023/01/27/ARTIRrGuBy58qSQU9KmHJp8q230127.shtml
2023-01-27 14:56:22,跨越重重难关 一杯长江水带来远方的甘甜,央视网消息：过年回家，无论是准备一桌热闹的年夜饭，还是泡碗热茶，“水”都是家家户户离不开的元素。然而，对于很多北方地区的老百姓来说，这杯水却并不简单，它很可能来自于千里之外，跨越了重重难关。最新数据显示，南水北调工程目前累计调水量为598亿立方米，惠及沿线42座大中城市、280多个县市区的1.5亿人。一杯长江水，跨越了千里，一路上穿越黄河、渡过冰期，在超过十万个传感器的守护下奔流而来，只为送上这份来自远方的甘甜。,传感中国】来自远方的甘甜,https://news.cctv.com/2023/01/27/ARTIxevGVZqOCQlCB4Q5oyHn230127.shtml
2023-01-27 14:55:04,岗位就是战位 我为祖国巡海天,万家团圆时，官兵备战忙。节日期间，各部队按计划组织节日战备练兵，检验部队快速反应能力，确保节日战备万无一失。,节日在战位 我为祖国巡海天,https://news.cctv.com/2023/01/27/ARTIIWlpw1AFSp8LHb6l6DHG230127.shtml
2023-01-27 14:52:12,北京地铁6号线、7号线今晚延长运营一小时,北京地铁公司1月27日在其官方微博发文表示，将根据客流数据情况，在首班车前后酌情加开临客，在末班车后延长运营时间，确保运力充足。,北京地铁,https://news.cctv.com/2023/01/27/ARTIJQvrCkDXOpzrSsnJxBd3230127.shtml
2023-01-27 14:21:20,中国编号最大站台的春运时刻,西安北站有个中国编号最大的站台——34站台。春节假期，南来北往的旅客从这里踏上回家的旅途。,中国 编号最大站台 春运 时刻,https://photo.cctv.com/2023/01/27/PHOA4mls45nF0fxaUSEXcNvH230127.shtml
2023-01-27 13:57:33,铁路部门多措施满足旅客返程需求,今天是大年初六，春节假期最后一天，也是春运的第21天，这两天全国交通出行迎来返程客流。昨天（1月26日），全国铁路预计发送旅客1025万人次，开行旅客列车1万0138列，两个数据环比均有大幅提升。,铁路部门多措施满足旅客返程需求,https://news.cctv.com/2023/01/27/ARTIuvVpEuPEABo7yyxFn10L230127.shtml
2023-01-27 13:56:15,冰雪旅游持续升温 引领春节出游新风尚,而在今年春节期间，冰雪旅游也持续升温。越来越多的市民、游客来到滑雪场，感受冰雪游的独特乐趣。,"""家门口""滑雪场 引领春节出游""新风尚""",https://news.cctv.com/2023/01/27/ARTI7ZdgwZHIQIgzDfsRZXrT230127.shtml
2023-01-27 13:55:23,远离节后综合征 调整节奏再出发,节后不少人都会出现“节后综合征”，又累又困打不起精神。节后综合征指的是人们由假期的放松状态突然进入工作的紧张状态时生理和心理的平衡被打破，进而产生的一系列问题。对此，专家提示要从身心几个方面自我调整。,远离节后综合征 调整节奏再出发,https://news.cctv.com/2023/01/27/ARTIvVzzdLjyKbzpHxwHEzoA230127.shtml
2023-01-27 13:53:55,新街区“老”味道 欢乐祥和过大年,今天是农历大年初六，春节假期已经接近尾声了。不过，国内各地旅游市场热度不减。这个春节假期，各地都举办了丰富多彩的民俗活动，吸引了不少市民游客前来感受浓浓年味儿。,新街区“老”味道 欢乐祥和过大年,https://news.cctv.com/2023/01/27/ARTI5ZR7acGLz8PHoYqocTcY230127.shtml
